id_producto,nombre,descripcion,FK_tipo_producto,FK_precio_producto
1,tatuaje de runas,el cliente selecciono un tatuaje de catalogo del artista del local,1,1
2,tatuaje de serpiente,El cliente trajo un tatuaje de referencia,2,2
3,tatauje unico ,el cliente pidio un tatuaje que fue dise침ado en el local,3,3
4,tatuaje dise침ado por cliente amalgama,el cliente trajo un tatuaje dise침ado por el,4,4
5,Expansi칩n,piercing con joya incluida comprada en el local,5,5
6,barras,piercing sin joya incluida pues el cliente trajo la suya,6,6
